sub_title,date,Newspaper,Body Text,title
"Mohammed Barakat , who played for Ahly Gaza and Palestine , died when his house in Khan Younis wa bombed by Israeli force .",11 Mar 2024,al-j,palestinian footballer mohammed barakat ha been killed in an israeli bombing of his house in khan younis during the ongoing war in gaza .,palestine footballer barakat killed in israel ’ s war on gaza
"A Palestinian journalist ha been reliving his painful journey in search of his missing mother , which ended in the discovery of her body at Gaza ’ s al-Shifa hospital . Witnesses told him she had been executed .",29 Apr 2024,al-j,,"palestinian journalist search for missing mother , only to find her body"
Gaza-born forward Mohammed Balah tell Al Jazeera how the war ha brought his promising football career to a halt .,2 Apr 2024,al-j,it had barely been three month since palestinian international footballer mohammed balah made his long-awaited return to al sadaqa football club in gaza when israel launched it war on the strip following the october 7 hamas attack in southern israel .,‘ i ’ ve lost everything ’ : palestine footballer balah on israel ’ s war on gaza
"South Africa warns Palestinians in Gaza are facing starvation , asks court to order all party to cease hostility .",6 Mar 2024,al-j,"south africa ha asked the international court of justice ( icj ) to order additional emergency measure against israel over it war on gaza , the court ha said .",south africa asks icj for more measure against israel over gaza ‘ famine ’
Israeli attack kill dozen of Palestinians including 15 people at a sport centre where war-displaced people were sheltering .,30 Mar 2024,al-j,"here ’ s how thing stand on saturday , march 30 , 2024 :","israel ’ s war on gaza : list of key event , day 176"
"Muslims around the world mark the start of Ramadan . For many , that includes marking 157 day of Israeli assault in Gaza .",11 Mar 2024,al-j,,the take : observing ramadan against the backdrop of war
"The UN Security Council approved a US-sponsored resolution calling on Hamas to accept a ceasefire proposal , with 14 vote in favour and one abstention from Russia . The US say Israel ha already agreed to the deal .",10 Jun 2024,al-j,,un security council endorses us-proposed plan for gaza ceasefire
Daqqa wa arrested by Israel in 1986 for killing an Israeli soldier and ha remained in prison since then .,7 Apr 2024,al-j,"imprisoned palestinian novelist and activist walid daqqa , who wa suffering from cancer , ha died in israel ’ s shamir medical center , according to the palestinian commission of detainee and ex-detainees affair .",terminally ill palestinian prisoner walid daqqa dy in israeli custody
Palestinians in Gaza observe Ramadan in ruined mosque a Israeli siege and bombardment leaf ‘ hunger everywhere ’ .,11 Mar 2024,al-j,the live page is now closed . you can continue to follow our coverage of the war in gaza here .,israel ’ s war on gaza update : no plan to protect civilian in rafah – u
"Disillusioned with the UK opposition ’ s stance on Gaza , British Palestinian professor Kamel Hawwash plan to run in the general election .",15 May 2024,al-j,"london , england – a the united kingdom gear up for a general election , trust in the ruling and main opposition party among some community is in sharp decline over their position on israel ’ s war on gaza .","‘ a someone with palestinian heritage , i couldn ’ t stay in the labour party ’"
Health Ministry report ‘ large number ’ of killed and wounded rushed to hospital a a result of nonstop Israeli bombardment .,8 Jun 2024,al-j,"the death toll in israel ’ s latest military assault across the gaza strip ha risen to 226 and more than 400 wounded , according to the government medium office in the besieged territory .",‘ body scattered on street ’ : israel kill 226 in central gaza attack
"Despite being thousand of mile away , I constantly think of my patient in Gaza , and wonder : Did they make it ? Are they still alive ?",3 May 2024,al-j,"i arrived in rafah in the early hour of october 9 and made my way to my family home in gaza city amid intense israeli air strike . the next day , i walked with my cousin to al-shifa hospital to begin work , not realising this would be the beginning of a 43-day nightmare .",i spent 43 day in gaza ’ s now-destroyed hospital . my mind is still there .
A 13-year-old Palestinian boy who wa setting off firework ha been shot dead by an Israeli soldier in occupied East Jerusalem .,13 Mar 2024,al-j,,13-year-old palestinian boy shot dead by israeli troop
The visa process,5 Apr 2024,al-j,"montreal , canada – “ unlivable . ” that ’ s how canada ’ s immigration minister , marc miller , described the situation in the gaza strip in late december .",' mission impossible '
Starvation and disease pose imminent danger .,19 Mar 2024,al-j,"a israel ’ s brutal war on gaza continues , the 2.3 million resident of the besieged palestinian territory face the imminent risk of famine .",how can israel ’ s war on gaza be allowed to continue ?
"Forced to flee Israeli strike , ten of thousand of people in southern Lebanon have no home to return to after 6 month of cross-border clash . Israeli attack have killed at least 50 civilian and according to the Israeli army , troop are being reinforced , in preparation for a wider war .",9 Apr 2024,al-j,,cross-border fighting with israel leaf lebanese town in ruin
Israeli army kill more Palestians in Gaza after takeover of crossing on vital route for aid delivery .,8 May 2024,al-j,israel ’ s seizure of the rafah crossing worsens an already dire situation for the 2.3 million palestinian in gaza .,will israel face consequence over it seizure of the rafah crossing ?
Palestinians have been holding prayer to mark the start of Eid al-Fitr which is being overshadowed by Israel ’ s war on Gaza .,10 Apr 2024,al-j,,eid prayer by palestinian in gaza and jerusalem ’ s al-aqsa mosque
"According to medium report , arm export have grown during wartime in another sign of ever-warming tie .",10 Apr 2024,al-j,"throughout israel ’ s war on gaza , serbia ha sought to publicly avoid political involvement in the conflict , with belgrade maintaining a relatively neutral position aimed at preserving relationship .","a gaza is pummelled , is serbia secretly sending weapon to israel ?"
"Protesters accused police of excessive force during arrest at an anti-war demonstration camp at the United States ’ Emory University , where one female professor wa hauled to the ground and detained and another demonstrator wa tasered .",26 Apr 2024,al-j,,professor arrested a police use ‘ violence ’ to clear u university camp
Dr Ghassan Abu-Sittah share how he won the fight to share his account of Gaza a Palestinians mark Nakba Day .,15 May 2024,al-j,,the take : a palestinian doctor ’ s fight to speak about gaza on nakba day
“ Before the war I wa beautiful . ” A young girl in Gaza say witnessing all the death and destruction in Israel ’ s war ha made her ugly .,14 Mar 2024,al-j,,‘ the war made me ugly ’ say palestinian girl
"Colombia ’ s president Gustavo Petro say the country is cutting diplomatic tie with Israel over it war on Gaza . Speaking to a large crowd marking International Workers ’ Day in Bogota , Petro said , “ If Palestine dy , humanity dy ” .",2 May 2024,al-j,,colombia president cut tie with israel over war on gaza
Rescue worker used a pulley to transfer an injured Palestinian man out from the second floor of a bombed residential tower in Rafah . Israeli attack struck several other home overnight in Gaza .,29 Apr 2024,al-j,,rafah rescue team us pulley to retrieve man injured by israeli attack
"Pro-Palestine protester shut down the Golden Gate bridge a part of a global day of action over Israel ’ s war on Gaza , which also saw key economic site blockaded in city across the world .",16 Apr 2024,al-j,,global day of action over gaza war
Some victim found at two hospital were ‘ buried alive ’ while others were ‘ executed ’ by the Israeli military .,25 Apr 2024,al-j,"mass graf found in two hospital in the gaza strip containing 392 body , including those of woman , child and the elderly , showed sign of torture and execution , official in the enclave have said .",evidence of torture a nearly 400 body found in gaza mass graf
How data fuel law,20 Mar 2024,al-j,"burlington , vermont – if it can happen here , it can happen anywhere .",' rendered invisible '
"Antonio Guterres say ‘ nothing can justify the collective punishment ’ in Gaza , and call for more aid access to the enclave .",5 Apr 2024,al-j,"israel ’ s military campaign in gaza ha brought “ relentless death and destruction ” to palestinian in the strip , united nation secretary-general antonio guterres ha said .",israel ha brought ‘ relentless death and destruction ’ to gaza : un chief
Children among the dead and wounded in the latest Israeli air strike on a UN shelter in northern Gaza City a tank surround ‘ safe zone ’ in southern Rafah .,23 Jun 2024,al-j,this live page is now closed .,israel war on gaza update : ‘ we ’ re running from death towards death ’
US Secretary of State Antony Blinken wa alerted in December of alleged human right abuse by Israeli soldier . What is being done about them ?,23 Apr 2024,al-j,,the take : why israeli military unit could be sanctioned by the u
Spokesman for UN ’ s humanitarian office say half of March food convoy to north Gaza were denied access .,9 Apr 2024,al-j,the live page is now closed . you can continue to follow our coverage of the war in gaza here .,"israel ’ s war on gaza update : israel blocked half of march food convoy , un"
"Islamic authority say more than 1,100 Israelis encroached on Al-Aqsa Mosque compound during provocative annual parade .",5 Jun 2024,al-j,"thousand of israeli have joined a march through occupied east jerusalem , with some attacking palestinian and shouting racist slogan , a part of an annual demonstration marking israel ’ s occupation of the city .","thousand of israeli march through jerusalem , some attacking palestinian"
"Nod for long-threatened invasion of Rafah , home to 1.4 million displaced people , come a Israel to send team to Qatar .",16 Mar 2024,al-j,"israel ’ s prime minister benjamin netanyahu ha approved plan for an attack on rafah , where 1.4 million displaced palestinian have sought shelter , while planning to send a team to further truce talk in qatar after mocking a ceasefire proposal by hamas a “ ridiculous ” .",israel approves plan to attack gaza ’ s rafah but keep truce talk alive
Israel ’ s military say it ha withdrawn force from southern Gaza a the war enters it seventh month .,8 Apr 2024,al-j,"“ it smell like death , ” say maha thaer , a mother of four , a she return to her devastated home in khan younis after israeli troop announced their withdrawal from southern gaza .",khan younis ‘ smell like death ’ a palestinian return to devastated home
Washington is considering to impose sanction on the Israeli military unit accused of right abuse against Palestinians .,25 Apr 2024,al-j,"the united state is considering imposing sanction on the israeli battalion , netzah yehuda , an all-male ultra-orthodox battalion unit accused of human right violation during it operation in the occupied west bank , according to u medium report .","what is netzah yehuda , the israeli battalion facing possible u sanction ?"
A group of Israel supporter have attacked anti-war protester at UCLA university in Los Angeles in the US . The group wa filmed carrying out assault and using firework and pepper spray on demonstrator at the Gaza war protest encampment .,1 May 2024,al-j,,israel supporter attack anti-war protester at ucla university in u
"Israel and Hamas are both condemning a decision by the International Criminal Court ’ s chief prosecutor to seek arrest warrant for their leader . Israel say the application is a crime of historic proportion , while Hamas claim the warrant equate the victim with the executioner .",20 May 2024,al-j,,icc seek arrest warrant for leader of israel and hamas
"Hezbollah and the Israeli army confirm a commander of the armed group wa killed in a drone strike on a car in southern Lebanon . The strike on Ismail Yusaf Baz come a Hezbollah claim to have hit an Israeli Iron Dome battery , causing casualty among the Israeli crew .",16 Apr 2024,al-j,,hezbollah commander killed in israeli drone strike in lebanon
"Pro-Palestine protest are growing in momentum , while also being accused of threatening the safety of student at US university campus .",23 Apr 2024,al-j,,u university crack down on pro-palestine protest
Over 130 student have been arrested after police cleared the UCLA campus of anti-Gaza war demonstrator following order from the university to disperse what they called an unlawful gathering .,2 May 2024,al-j,,police clear pro-palestine encampment at ucla
"During a visit to Egypt , Antonio Guterres warns of the impact Israel ’ s months-long war on Gaza is having around the globe .",24 Mar 2024,al-j,"the only effective and efficient way to deliver heavy good to meet gaza ’ s humanitarian need is by road and includes an exponential increase in commercial delivery , say the united nation secretary-general antonio guterres .","only effective way to ramp up gaza aid is by land , un chief guterres say"
McDonald ’ s ha been subject to boycott since franchisee Alonyal announced it would donate free meal to the Israeli military amid Gaza war .,5 Apr 2024,al-j,"mcdonald ’ s ha said it will buy it 30-year-old israel franchise from alonyal , taking back ownership of 225 outlet that employ more than 5,000 people .",mcdonald ’ s buy all 225 of israeli franchise restaurant after boycott
An aid ship carrying food and other essential item is nearing Gaza after day of delay amid dire humanitarian situation .,13 Mar 2024,al-j,"here ’ s how thing stand on wednesday , march 13 , 2024 :","is­rael ’ s war on gaza : list of key event , day 159"
Relentless air and artillery strike pound southern and central Gaza a more starvation death reported in the north .,9 Mar 2024,al-j,this live page is now closed . you can continue to follow our coverage of the war on gaza here .,israel ’ s war on gaza update : israeli strike kill dozen of palestinian
"Despite outcry over abuse in Gaza war , US president stress that his commitment to Israel ’ s security is ‘ ironclad ’ .",24 Apr 2024,al-j,"washington , dc – u president joe biden ha signed into law a $ 94bn foreign funding bill that includes military aid to israel , ukraine and taiwan , ending a months-long legislative impasse in washington over the assistance .","biden sign law securing billion in u aid for ukraine , israel"
"Negotiation could lead to a ‘ dead end ’ say Hamas official Hamdan , a US diplomat Antony Blinken arrives in Saudi to push deal .",20 Mar 2024,al-j,the live page is now closed . you can continue to follow our coverage of the war in gaza here .,israel ’ s war on gaza update : israel ‘ negative ’ on hamas truce proposal
The anti-war protest at Columbia University escalated on Tuesday when a group of student took over a faculty building after the university began suspending student who refused to leave their protest camp .,30 Apr 2024,al-j,,how gaza protest at columbia university ha escalated
The UN Security Council ha passed it first resolution demanding an immediate ceasefire in Gaza after nearly six month of war . Here are some of the key takeaway .,26 Mar 2024,al-j,,what doe the un resolution on gaza ceasefire mean ?
"From France to Australia , university student are part of pro-Palestine protest a Columbia student continue encampment .",26 Apr 2024,al-j,clash between student and police officer have been reported all over the united state during intensifying university protest .,are u campus protest against israel ’ s war on gaza going global ?
"US reluctance to pressure Israel into accepting the ceasefire deal will have grave consequence , and not just for the Palestinians .",8 May 2024,al-j,"on may 5 , the breaking news that hamas had accepted a ceasefire deal spread like wildfire across gaza , sending people to the street celebrating . their joy wa short-lived , however , a israel pressed forward with a deadly ground assault on rafah .",the u and israel are playing a dangerous game
"The attack on October 13 killed a Reuters reporter and injured six others , including two Al Jazeera journalist .",7 Mar 2024,al-j,"an israeli tank crew “ likely ” opened machinegun fire on an identifiable group of journalist near the border with lebanon who were also targetted by shelling , a new report ha found .",israeli tank ‘ likely ’ fired machinegun at journalist near lebanon border
"Houthi-claimed missile attack on Greek-operated , Barbados-flagged commercial ship kill three sailor off the coast of Yemen .",6 Mar 2024,al-j,"at least three seafarer have been killed in a houthi missile attack on a merchant ship in the gulf of aden , the united state military said , marking the first fatality reported since the iran-aligned yemeni group began attack against shipping in one of the world ’ s busiest sea lane over israel ’ s war on gaza .",houthi attack kill three sailor in group ’ s first fatal strike on shipping
"Revenues from Qatar ’ s LNG field will provide budget surplus until the 2030s , Fitch said .",20 Mar 2024,al-j,"fitch rating ha upgraded qatar to aa , it third-highest rating , on the back of revenue expected from it expanded gas field , the agency ha said .",fitch rating upgrade qatar to third-highest on back of gas expansion
Turkey ’ s Ministry of Trade cite humanitarian crisis in Gaza for it decision to suspend import and export .,2 May 2024,al-j,"turkey ha halted export and import to and from israel , the turkish ministry of trade say , citing the “ worsening humanitarian tragedy ” in gaza .",turkey say it halt trade with israel over gaza aid access
"Israel is threatening all out war against the Lebanese group Hezbollah , which could be catastrophic for both country , say analyst .",7 Jun 2024,al-j,tension and tit-for-tat attack are escalating between israel and the lebanese group hezbollah .,are lebanon ’ s hezbollah and israel about to go to war ?
Palestinian official say Israeli force killed 274 people during the operation to rescue four captive held in Gaza .,11 Jun 2024,al-j,the united nation human right office say war crime may have been committed by both israeli force and palestinian armed group during an israeli raid on nuseirat in central gaza last week .,israeli killing of gaza civilian during raid may be war crime : un
"At least three people have died in a Houthi attack on a merchant ship near Yemen , the first fatality since the group began strike in response to Israel ’ s war on Gaza . Here ’ s what we know .",7 Mar 2024,al-j,,what we know about deadly houthi attack on cargo ship
Regular protest have been taking place outside Australian firm making crucial component for the F-35 fighter jet .,28 Mar 2024,al-j,"melbourne , australia – israel ’ s continued assault on gaza ha highlighted a hidden yet crucial component of the world ’ s weapon manufacturing industry – suburban australia .",australia challenged on ‘ moral failure ’ of weapon trade with israel
"Protests , message weaved into commencement address and the heckling of guest speaker , including comedian Jerry Seinfeld are just some of the way student in the US showed support for Palestine during graduation ceremony in the US .",13 May 2024,al-j,,u student use graduation to stand with palestine
Groups and politician in Israel have launched a campaign for early election and a deal to release the captive .,18 Jun 2024,al-j,several antigovernment group in israel have launched a week of resistance against the government .,will israel ’ s week of resistance make a difference ?
Students must not allow sensationalist medium coverage of their mobilisation to overshadow news of Israeli atrocity in Palestine .,30 Apr 2024,al-j,"on april 22 , student set up an encampment at the university of michigan to demand the university ’ s complete and total divestment from genocidal israel . they thus joined dozen of other university across the united state in standing up in solidarity with the palestinian people who are facing genocide at the hand of the israeli army . israeli force have killed more than 34,500 palestinian , including 14,500 child , in gaza and nearly 490 , including 124 child , in the occupied west bank .","encamp , divest and keep your eye on gaza"
"Germany is forcing Palestinians to pay for it own genocidal crime and targeting Jews and Muslims who speak out , say British writer Owen Jones . He ’ s calling on artist and performer to boycott public event in Germany .",19 Mar 2024,al-j,,‘ boycott germany for forcing palestinian to pay for it crime ’
Columbia University ’ s Jeffrey Sachs say the war in Gaza could end today if the United States stopped supplying weapon to Israel .,17 Mar 2024,al-j,"“ doe the united state want to be complicit in genocide ? ” this is the question that u leader should be asking themselves a israel ’ s war on gaza continues , argues columbia university professor jeffrey sachs .",professor jeffrey sachs : ‘ u is complicit in israeli genocide ’
"According to United Nations data , more than half of Gaza ’ s home have been destroyed or damaged – a have 267 place of worship .",27 May 2024,al-j,"in a bid to keep palestinian culture alive , child sheltering in rafah , southern gaza , have created stunning picture of historical building destroyed in the seven-month israel-palestine war .",palestinian child draw memory of bombed historical building
Delivery fall far short of the minimum UN requirement to stave off the ongoing humanitarian crisis in the besieged territory .,8 Apr 2024,al-j,"israel ha announced the entry of more than 300 aid truck into gaza , the highest daily volume since it war on the besieged territory began six month ago .",more than 300 aid truck enter gaza a palestinian battle starvation
"While the US did not veto the recent Gaza ceasefire resolution , it continues to supply arm to Israel .",26 Mar 2024,al-j,"after more than five month of fighting and five vetoed draft resolution , united nation security council ( unsc ) member on monday successfully passed a resolution calling for an immediate ceasefire between israel and hamas in gaza .",will the un ceasefire resolution stop israel ’ s war on gaza ?
Nearly 190 advocacy organisation laud student ’ ‘ courage ’ amid ongoing crackdown on encampment across US university .,29 Apr 2024,al-j,"washington , dc – dozen of faith , civil right and progressive group in the united state have expressed solidarity with university student protesting against u support for israel amid the war on gaza .",u advocacy group back palestine solidarity campus protest amid gaza war
The United Nations Security Council is scheduled to vote on a draft ceasefire resolution at 10am New York time .,25 Mar 2024,al-j,"here ’ s how thing stand on monday , march 25 , 2024 :","is­rael ’ s war on gaza : list of key event , day 171"
"Huge number trapped beneath rubble , buried in unmarked graf , detained by Israel , say Save the Children .",24 Jun 2024,al-j,"nearly 21,000 child are missing in gaza , british aid group save the child ha claimed .","over 20,000 child buried , trapped , detained , lost amid gaza war : report"
"Germany ’ s student , labelled ‘ terrorist sympathiser ’ for protesting against Israel ’ s war on Gaza , say their right to free speech is under attack .",25 May 2024,al-j,"berlin – “ we are witnessing a great endangerment of academic freedom – and this ha started since the beginning of israel ’ s war on gaza , ” say cecilia , an undergraduate student at berlin ’ s free university .","punched , choked , kicked : german police crack down on student protest"
We look at whether there is a shift within the Jewish community against Israel ’ s action and policy .,15 Mar 2024,al-j,"israel ’ s war on gaza rage on , now in it sixth month , causing mass devastation and resulting in the death of more than 31,000 palestinian , mostly woman and child . with mounting humanitarian crisis , jewish group across the world have rallied in large number to denounce israel ’ s action and policy .",is this a watershed moment for jewish solidarity with palestinian ?
"The Israeli leader say troop will go ahead with the ground offensive in southern Gaza , spurring fear of mass Palestinian casualty .",17 Mar 2024,al-j,israeli prime minister benjamin netanyahu say israel will not leave civilian trapped in rafah when it force begin a long-feared assault on the southern gaza city where more than a million palestinian have taken shelter .,"netanyahu repeat rafah assault threat , say civilian won ’ t be ‘ locked in ’"
"Meanwhile , mediator urge Israel and Hamas to accept ceasefire plan laid out by Biden a humanitarian situation worsens .",2 Jun 2024,al-j,this live page is now closed . you can continue to follow our coverage of the war in gaza here .,israel ’ s war on gaza update : 50 body recovered from jabalia refugee camp
Luis Moreno Ocampo discusses the International Criminal Court arrest warrant request for Israeli and Hamas leader .,24 May 2024,al-j,"a israel ’ s war on gaza keep raging , the chief prosecutor of the international criminal court ( icc ) ha requested arrest warrant for israeli prime minister benjamin netanyahu and defence minister yoav gallant for war crime and crime against humanity . the prosecutor , karim khan , ha taken the same action against three hamas leader .",former icc chief prosecutor : ‘ netanyahu is afraid ’
