sub_title,date,Newspaper,Body Text,title
"Pope Francis say his thought go to those facing war , especially child who have ‘ forgotten how to smile ’ .",31 Mar 2024,al-j,"pope francis ha renewed call for an immediate ceasefire in gaza and the release of all israeli captive in a peace-focused address marking easter sunday , the most important day on the christian calendar .","pope renews call for gaza ceasefire , release of captive in easter address"
The meaningless ceasefire resolution his administration allowed the UN Security Council to pas should not fool anyone .,2 Apr 2024,al-j,united state president ronald reagan ’ s order to israeli prime minister menachem begin to put an end to his “ holocaust ” in lebanon is perhaps the best-known political anecdote from israel ’ s 1982 invasion .,biden is still the best u president israel could wish for
Israeli strike continue to kill Palestinians a PM Netanyahu face pressure from all side over ceasefire proposal .,3 Jun 2024,al-j,the israeli military ha launched more air strike across the gaza strip to deadly effect a official discus the latest proposed deal to end hostility and exchange prisoner .,israeli air strike continue across gaza a truce talk struggle
Students staging sit-in and hunger strike at the French university leave campus without incident .,3 May 2024,al-j,french police officer entered the paris institute of political study ( science po ) in paris and removed pro-palestinian student activist who had occupied it building to protest israel ’ s war on gaza .,police remove pro-palestinian student from paris ’ s science po university
Search team in Gaza say they ’ ve uncovered hundred of body in the ground of Nasser Medical Complex in the city of Khan Younis . The hospital wa raided by Israeli force before their recent withdrawal from the area .,22 Apr 2024,al-j,,mass graf found at southern gaza hospital raided by israeli force
United Nations chief say Israel ’ s military campaign in Gaza ha brought ‘ relentless death and destruction ’ .,6 Apr 2024,al-j,"here ’ s how thing stand on saturday , april 6 , 2024 :","israel ’ s war on gaza : list of key event , day 183"
"Relatives of Gaza captive locked themselves in cage and blocked road in Tel Aviv , calling on Israeli Prime Minister Benjamin Netanyahu to reach a deal to release their loved one .",27 Mar 2024,al-j,,relative of gaza captive protest in cage
The International Court of Justice ha issued a legally binding order for Israel to halt it invasion of Rafah .,24 May 2024,al-j,"the international court of justice called on israel to end it operation in rafah , the southernmost town in gaza .","icj rule israel must stop rafah operation , what ’ s next ?"
Commission of Inquiry accuses Israel and Palestinian group of war crime . Here ’ s a breakdown .,13 Jun 2024,al-j,"a united nations-backed inquiry ha concluded that war crime have been committed by israel and by hamas a well a other palestinian group , during the now eight-month conflict .","israel in gaza , palestinian fighter in israel , what the un accuses them of"
More than 300 body retrieved from two of the largest hospital in Gaza after Israeli siege end this month .,24 Apr 2024,al-j,the discovery of a mass grave inside the nasser medical complex in khan younis in the southern gaza strip this week ha been met with grief and horror from palestinian and ha drawn condemnation from the united nation and call for a transparent and credible investigation .,uncovering of mass grave at gaza ’ s nasser hospital : what you need to know
British government is coming under growing pressure to halt weapon supply to Israel a it continues it war on Gaza .,9 Apr 2024,al-j,"the united kingdom will not halt arm sale to israel by british company after reviewing the latest legal advice on the matter , foreign minister david cameron ha said .","uk will not block arm sale to israel , say foreign minister david cameron"
"The Israeli army ha said that eight rocket were fired from Gaza , targeting central Israel , including Tel Aviv .",26 May 2024,al-j,"hamas say it ha launched rocket at tel aviv , prompting siren to sound in the israeli city for the first time in several month .","hamas fire rocket at israel ’ s tel aviv , causing first siren for month"
Activists in Pakistan called out the German ambassador ’ s alleged hypocrisy for speaking at a human right forum while Germany stifle criticism of Israel ’ s assault on Gaza . The pro-Palestinian demonstrator were quickly removed from the Asma Jahangir Conference by authority .,28 Apr 2024,al-j,,pakistani activist heckle german ambassador over gaza
Israel ha ignored call from it Western ally not to conduct a major operation in Rafah and faced no consequence .,30 May 2024,al-j,"israeli tank have rolled into rafah ’ s city centre and it army announced that it now control the entire philadelphi corridor , the strip of land that run along egypt ’ s border with gaza ’ s rafah governorate .",how israel pushed dotted ‘ red line ’ to have it way in rafah
"Hezbollah chief Nasrallah say support for Gaza is ‘ final ’ , a cross-border fighting displaces thousand of people .",13 May 2024,al-j,the head of powerful lebanese armed group hezbollah said that resident of northern israel would not be able to return home for the start of the next school year if their government pressed on with it assault on the gaza strip .,hezbollah say will keep fighting if israel press on with assault on gaza
Hamas say negotiation to continue next week even a Israel ‘ thwart ’ deal to secure 40-day truce before Ramadan .,7 Mar 2024,al-j,"hamas say it delegation ha left egypt but talk on a ceasefire in the gaza strip will continue next week until an agreement is reached with israel , whom the palestinian group say ha “ thwarted ” mediator ’ attempt to broker a deal before the muslim holy month of ramadan .",gaza ceasefire talk end in cairo with ‘ no substantial answer or solution ’
Al Jazeera look at Washington ’ s main statement and position on Israel ’ s war in Gaza and how policy shifted over time .,7 Mar 2024,al-j,"washington , dc – a israel ’ s war in gaza prompt mounting human right concern , the united state ha slowly notched up criticism of the israeli government while simultaneously continuing to arm and support it ally .","timeline : the biden administration on gaza , in it own word"
"Israel ha attacked twice since Sunday , killing ten of people in horrific circumstance .",28 May 2024,al-j,"thirteen out of 21 people killed by israel in an air strike on the so-called “ safe area ” of al-mawasi were civilian woman and girl , al jazeera ’ s hind khoudary reported on tuesday .",what happened when israel attacked rafah ?
Government spokesman say Al-Aqsa Hospital at three time it clinical capacity a dead and wounded continue to arrive .,6 Jun 2024,al-j,"an israeli air attack on a un-run school sheltering displaced palestinian in central gaza ’ s nuseirat camp killed at least 40 people , mainly woman and child , according to local government official .","israel attack un-run school in central gaza , killing at least 40"
"Israel ’ s military campaign ha brought ‘ relentless death and destruction ’ for people in Palestine , say UN Secretary General Antonio Guterres . In a speech marking six month of war in Gaza , Guterres said nothing can justify the ‘ collective punishment ’ taking place there .",5 Apr 2024,al-j,,"‘ silence the gun , ’ say un chief in speech marking 6 month of war on gaza"
Two mass graf were discovered in Gaza on Monday — one at al-Shifa Hospital and the second in Beit Lahiya .,16 Apr 2024,al-j,"here ’ s how thing stand on tuesday , april 16 , 2024 :","israel ’ s war on gaza : list of key event , day 193"
Israeli prime minister say he will fight any sanction targeting Israeli military unit for alleged right violation .,21 Apr 2024,al-j,"israeli prime minister benjamin netanyahu ha said he would fight against any sanction being imposed on israeli military unit for alleged right violation , after a united state medium outlet reported that washington wa planning such a step .",u set to impose sanction on israeli military unit over abuse : report
"Media watchdog decry Ismail al-Ghoul ’ s arrest from al-Shifa Hospital , where thousand of civilian are trapped .",18 Mar 2024,al-j,al jazeera arabic correspondent ismail al-ghoul ha been released after being arrested for 12 hour and severely beaten by israeli force in gaza city ’ s al-shifa hospital .,al jazeera journalist freed after 12-hour arrest by israeli force in gaza
Germany and the US are rendering a draft resolution on the Bosnian genocide meaningless with their position on Gaza .,22 May 2024,al-j,"on may 1 , a draft resolution wa submitted to the united nation general assembly ( unga ) to declare july 11 a day of remembrance for the 1995 srebrenica genocide . the document wa put forward by germany and rwanda and co-sponsored by the united state and other country . it will be debated and voted on during a unga session on may 23 .",the theatrics of genocidal impunity
Daniel Hagari go against Netanyahu by saying that identifying the impossible task of defeating Hamas a Israel ’ s end goal in Gaza mean ‘ throwing sand in people ’ s eye ’ .,20 Jun 2024,al-j,al jazeera is reporting from outside israel because it ha been banned by the israeli government .,israeli military spokesman ’ s hamas defeat remark widen rift with netanyahu
"The Israeli government and Palestinian group including Hamas have committed war crime during the war on Gaza , according to a report from the UN Commission of Inquiry . It detailed a long list of offence , including the use of extermination , starvation , indiscriminate attack , siege warfare , and sexual and other gender-based violence .",12 Jun 2024,al-j,,"un report on israel , hamas : murder , starvation , gender-based violence"
"Attacks target Hodeidah ’ s airport and region north of Sanaa , Al Masirah TV say , a Houthis continue Red Sea attack .",7 Jun 2024,al-j,"the united state and united kingdom have carried out six air strike against target in yemen , a houthi-run television station report , a the yemeni group target shipping lane in the red sea .","u and uk air strike hit yemen , houthi-run tv report"
"Video show the rescue of Palestinian girl who ’ d been trapped under rubble after an Israeli attack in Gaza . As she wa freed from the debris the child is seen asking for her mother , who died in the attack according to witness .",13 May 2024,al-j,,palestinian girl rescued from rubble after israeli attack in gaza
Israel ’ s assault on the Gaza Strip ha placed a pall over Eid celebration for Palestinians .,9 Apr 2024,al-j,"this year , the shadow of continued israeli attack on the gaza strip loom large over palestinian a they prepare for the muslim holiday of eid al-fitr , marking the end of the fasting month of ramadan .",photo : palestinian in gaza prepare for eid amid death and destruction
"As the world celebrates International Women ’ s Day , Gaza ’ s Health Ministry provided an update on the challenge facing woman in the Gaza Strip .",8 Mar 2024,al-j,"here ’ s how thing stand on friday , march 8 , 2024 :","israel ’ s war on gaza : list of key event , day 154"
A symbol of coexistence no more,8 Jun 2024,al-j,"on march 6 , ayman shaer found himself lying on the ground in the ancient square of sebastia , bleeding and in unbearable pain .",' they would have to kill me first '
"Police out in full force , some using chemical irritant and Tasers to disperse student , a more university join movement .",28 Apr 2024,al-j,"hundred of student have been arrested across university in the united state , with scuffle reported between pro-israeli and pro-palestinian demonstrator at ucla , a rally for a ceasefire in gaza and divestment from company linked to israel spread across u campus .","hundred of student arrested in u gaza war protest , scuffle at ucla"
"As an Israeli ground assault on Gaza ’ s last ‘ safe zone ’ loom , two child in Rafah brace for it .",25 Apr 2024,al-j,"“ we ’ re afraid people will resort to killing each other for food , ” 11-year-old husam say a he recount his daily battle to secure basic necessity like food , water and sanitation in rafah during the israel-hamas war .",how gaza ’ s child are preparing for israel ’ s invasion of rafah i close up
Two country warn of ‘ potentially devastating consequence ’ if Israel push ahead with ground offensive in Rafah .,22 Mar 2024,al-j,"australia and the united kingdom have called for an “ immediate cessation of fighting ” in gaza , warning of “ potentially devastating consequence ” if israel go ahead with a planned ground assault on the southern city of rafah .","uk , australia call for ‘ immediate ’ end to fighting in gaza"
Resolution call on UN Security Council to favourably reconsider Palestine ’ s request to become the 194th member of the United Nations .,10 May 2024,al-j,this live page is now closed . you can continue to follow our coverage of the war in gaza here .,israel ’ s war on gaza update : un overwhelmingly vote for palestine right
Many official around the world have welcomed the resolution .,25 Mar 2024,al-j,many world leader have welcomed a united nation security council ( unsc ) resolution that demand an immediate ceasefire between israel and the palestinian group hamas in gaza .,world reacts to unsc resolution demanding gaza ceasefire
"Aid truck are waiting an average of 20 day to access the enclave , the NGO say , a warning of impending famine rise .",18 Mar 2024,al-j,"israel is using bureaucracy to “ deliberately ” hinder aid supply headed into gaza , oxfam ha claimed .",oxfam accuses israel of ‘ deliberately ’ blocking aid to famine-stalked gaza
"Israeli Channel 14 aired her photo , claiming she wa a ‘ terrorist ’ . A few week later an Israeli missile killed her and her son .",26 May 2024,al-j,"on april 24 , amna homaid ’ s torn body lay in the rubble of a house in shati camp , in the western part of gaza city , a rescuer tried to find survivor . an israeli attack had struck the building , killing her and her eldest son mahdi . her brother and her other five child were injured but survived .",remembering palestinian journalist amna homaid
"US riot police have been filmed arresting a person who appears to be disabled during anti-war protest at the University of Texas . Dozens of student were arrested a police moved in to clear the encampment , reportedly using pepper spray to disperse crowd .",30 Apr 2024,al-j,,police arrest anti-war student protester at texas university
"Biden face pressure from foreign partner , right group and some fellow Democrats in Congress to impose condition on arm transfer to Israel .",2 Apr 2024,al-j,"u president joe biden ’ s administration is weighing whether to go ahead with an $ 18bn arm transfer package to israel that would include dozen of f-15 aircraft , according to the reuters news agency .","biden considers $ 18bn arm transfer to israel , including f-15 jet : report"
New attack come two week after Iran-aligned group said it targeted three vessel and a US warship .,25 Apr 2024,al-j,"yemen ’ s iran-aligned houthi armed group say it attacked u and israeli vessel , with a western coalition of warship defending amid the continuing fallout from the war on gaza .","yemen ’ s houthis launch attack on u , israeli vessel a warship defend"
"An Israeli air attack on a Gaza City clinic killed two people including the director of Gaza ’ s ambulance and emergency department Hani al-Jaafrawi , the enclave ’ s Health Ministry said . At least 500 medical staff have been killed in Gaza since October 7 .",24 Jun 2024,al-j,,gaza emergency health chief killed in israeli air attack
Israeli force tie wounded Palestinian man to a military jeep in an incident a UN expert said amounted to using him a a human shield .,23 Jun 2024,al-j,"israeli force in the occupied west bank have tied a wounded palestinian man to the hood of a military vehicle during a raid on the city of jenin , appearing to use him a a human shield .",‘ human shielding in action ’ : israeli force strap palestinian man to jeep
Francesca Albanese say there are clear indication that Israel ha violated three of five act listed under UN Genocide Convention .,26 Mar 2024,al-j,"there are “ reasonable ground ” to believe israel is committing genocide in the besieged palestinian enclave of the gaza strip , according to a report issued by a united nations-appointed expert .",un expert accuses israel of ‘ genocide ’ in gaza
"Israel ha rejected a ceasefire and launched an operation in Rafah , raising fear that the war in Gaza could drag on .",7 May 2024,al-j,"israel appears to have been blindsided by hamas ’ s announcement on monday that it had agreed to an egyptian-qatari ceasefire proposal . but the israeli government quickly made it position clear – the proposal wasn ’ t something it would agree to , and , to make matter more explicit , it military force took control of the palestinian side of egypt ’ s border with gaza in rafah .",‘ the goal is to destroy gaza ’ : why israel reject a ceasefire with hamas
"Heavy Israeli air raid kill dozen in central Gaza a US , Qatari and Egyptian mediator plan to resume talk .",5 Jun 2024,al-j,"dozen of palestinian have been killed in heavy israeli bombardment of the central gaza strip , a u , qatari , and egyptian mediator plan to resume talk on a proposed ceasefire and captive release deal .",israel expands gaza offensive a mediator ’ ceasefire bid continues
"Resolution doe not give Palestine full UN membership , but recognises it a qualified to join and extends new right and privilege .",10 May 2024,al-j,the united nation general assembly ( unga ) ha backed a palestinian bid to become a full un member by recognising it a qualified to join and recommending the un security council “ reconsider the matter favourably ” .,united nation general assembly back palestinian bid for membership
No immediate confirmation from Hamas after Israeli military spokesman say Issa wa killed in a strike ‘ two week ago ’ .,26 Mar 2024,al-j,israel ’ s military spokesman say hamas deputy military commander marwan issa wa killed earlier this month in an israeli attack on the gaza strip .,israel claim senior hamas commander marwan issa killed in gaza strike
“ They were laughing and playing ” . The Palestinian man who wa shot then tied to the front of an Israeli army vehicle and driven around ha been describing his treatment by soldier in the occupied West Bank .,24 Jun 2024,al-j,,palestinian who wa shot and tied to israeli army vehicle describes ordeal
Hamas say a delegation is set to visit Egypt soon for further ceasefire talk .,2 May 2024,al-j,this live page is now closed . you can continue to follow our coverage of the war in gaza here .,israel ’ s war on gaza update : hamas study proposal in ‘ positive spirit ’
"As the Muslim fasting month draw to a close next week , many Palestinians spend their day in prayer amid Israel ’ s war .",6 Apr 2024,al-j,"palestinian muslim are marking a tense and sombre last weekend in ramadan , a israel ’ s war on gaza approach the six-month mark .",palestinian mark last day of ramadan on the eve of six month of war
"The Associated Press news agency welcome decision to return equipment , raise concern about the Israeli government ’ s use of the new foreign broadcaster law .",21 May 2024,al-j,israel ’ s communication minister ha ordered that a camera and broadcasting equipment seized from the associated press ( ap ) news agency in southern israel should be returned .,israeli minister order return of equipment seized from ap news agency
"Spain ha formally recognised Palestine a a state in a ‘ historic move towards justice and the only route to achieve peace ’ according to Prime Minister Pedro Sanchez . Spain join Ireland , Norway and 144 other country to acknowledge Palestinian statehood .",28 May 2024,al-j,,spain formally recognises palestine a a state
Finance Minister Bezalel Smotrich ’ s announcement come despite international pressure against Israel ’ s building of illegal settlement .,22 Mar 2024,al-j,"israel ’ s finance minister bezalel smotrich ha declared 800 hectare ( 1,977 acre ) in the occupied west bank a state land , in a move that will facilitate the use of the ground for settlement building .",israel seizes 800 hectare of palestinian land in occupied west bank
"A panel of doctor spoke out at the UN about the horror and suffering they saw Palestinians face in Gaza , a Israel ’ s onslaught and blockade continue to make the healthcare system unviable .",20 Mar 2024,al-j,,doctor make appeal to un to stop the suffering in gaza
A new app in the US is helping people to boycott business deemed to be supporting Israel and it war on Gaza .,9 Apr 2024,al-j,,the app helping people boycott brand supporting israel
Congress ’ s invitation latest show of US support for Israel despite global outrage over Israel ’ s war on Gaza .,7 Jun 2024,al-j,"israeli prime minister benjamin netanyahu will address a joint meeting of the united state congress on july 24 , according to top u lawmaker .",gaza war : israel ’ s benjamin netanyahu to address u congress on july 24
"At least 15 others were wounded by Israeli force during an incursion into Jenin refugee camp , local official say .",6 Jun 2024,al-j,"israeli force have killed at least three palestinian during a raid in the jenin refugee camp in the occupied west bank , the palestinian health ministry ha said , a israel intensifies it deadly attack in the territory .",israeli force kill three palestinian in raid on west bank ’ s jenin
"Lack of aid , including food and vaccine , ha put thousand of child at risk of death , Government Media Office say .",18 Jun 2024,al-j,this live page is now closed . you can continue to follow our coverage of the war in gaza here .,"israel war on gaza update : gaza gov ’ t say 3,500 child at risk of dying"
"Before Ramadan fasting began , displaced Palestinian Abu Elias showed u how he prepares the famous Palestinian dish maqlouba for his family despite the shortage caused by Israel ’ s war on Gaza .",19 Mar 2024,al-j,,displaced palestinian cook maqlouba during wartime for his family
"The pier , which could take 60 day to build , might not be an effective solution to the urgent aid crisis in Gaza .",11 Mar 2024,al-j,president joe biden ha said the united state will set up a temporary pier off gaza to deliver humanitarian supply to the besieged enclave a palestinian begin to starve during israel ’ s blockade of the strip .,why is the u setting up temporary port off gaza for aid delivery ?
"Witnesses say Israeli helicopter and tank opened fire on crowd of desperately hungry people waiting for aid in north Gaza , where Israeli force have repeatedly been accused of attacking aid seeker .",15 Mar 2024,al-j,,israeli force accused of new massacre of people waiting for gaza aid
Global outrage and pressure on Israel following an attack that killed seven World Central Kitchen worker in Gaza this week .,4 Apr 2024,al-j,"here ’ s how thing stand on wednesday , april 4 , 2024 :","israel ’ s war on gaza : list of key event , day 181"
Antonio Guterres issue a stark warning a full-scale war between Lebanon ’ s Hezbollah and Israel ’ s army reach the brink .,21 Jun 2024,al-j,united nation secretary-general antonio guterres expressed increasing concern over the escalating war of word and deadly border clash between israel ’ s military and lebanon ’ s hezbollah fighter .,‘ world can not afford lebanon becoming another gaza ’ : un chief
"Governing ANC is vocally pro-Palestine while main opposition DA remains neutral on the Gaza war , which may affect voter on May 29 .",13 May 2024,al-j,"cape town , south africa – “ we can not allow supporter of baby killer to talk to u , ” a furious resident of surrey estate in cape town shouted a he heckled the speaker at the podium .",will israel ’ s war on gaza sway south africa ’ s election ?
A shortage of nappy because of Israel ’ s blockade ha led to price skyrocketing and mother looking for alternative .,7 Mar 2024,al-j,"deir el-balah , gaza – on a cold night three week ago , aida al-baawi rushed from the makeshift tent she had made home to the town ’ s nearby al-aqsa martyr hospital and , amid the ongoing war , gave birth to her daughter .","in gaza , baby have no more nappy , milk , a israeli bombing continues"
"“ It ’ s time to step back from the brink , ” UN Secretary General Antonio Guterres tell the UN Security Council meeting on Sunday . Guterres said the member state have a shared responsibility to work for peace and prevent further escalation of hostility .",14 Apr 2024,al-j,,un security council meet after iran launch attack on israel
"Request for tank ammunition , tactical vehicle for Israel despite Biden ’ s earlier pause on bomb over Rafah assault .",15 May 2024,al-j,"the biden administration ha told congress that it plan to send a $ 1bn package of military aid to israel , according to medium report , despite the united state ’ s opposition to a full-scale invasion of rafah in southern gaza and concern about rising civilian death .",biden administration plan to send $ 1bn in military aid to israel : report
"Months after having his contract terminated by German football club Mainz over his social medium post on Israel ’ s war on Gaza , Dutch player Anwar El Ghazi ha released a video saying he will continue to support Palestinians .",20 Jun 2024,al-j,,footballer el ghazi promise to continue fighting for palestinian
