sub_title,date,Newspaper,Body Text,title
"As Israel ’ s war rage in Gaza , Slovenia is joining a clutch of European nation that hope to pave a pathway to peace .",28 May 2024,al-j,"slovenia is set to recognise palestinian statehood in june , following in the footstep of ireland , norway , and spain .",slovenia ’ s ‘ moral duty ’ : what ’ s behind it push to recognise palestine ?
Iranian official warn Israel of a larger attack should it respond to overnight drone and missile assault .,14 Apr 2024,al-j,this page is now closed . follow the latest update here .,israel ’ s war on gaza update : un chief say middle east ‘ on the brink ’
“ Means and method of warfare to minimise civilian casualty appears to have been consistently violated . ” A report from the UN Office of Human Rights found a pattern of “ indiscriminate and disproportionate ” Israeli strike harming civilian in Gaza .,20 Jun 2024,al-j,,un report : israeli strike ‘ systematically ’ violating law of war
"Jared Kushner , former senior foreign policy adviser to Donald Trump , ha said waterfront property in Gaza could be “ very valuable ” and that Israel should move Palestinians out of Gaza to enable an attack on Rafah .",20 Mar 2024,al-j,,former trump official call gaza ’ s waterfront property ‘ very valuable ’
Russia and China veto US proposal that critic say fell short of demanding an end to Israel ’ s war on Gaza .,22 Mar 2024,al-j,"the united nation security council ha failed to pas a united state draft resolution calling for , but not demanding , a ceasefire in israel ’ s continuing war on gaza after two permanent member chose to veto it .",un security council doe not pas draft u resolution on gaza ceasefire
"“ Stop the carnage , ” South Africa told the ICJ in their third attempt to seek provision against Israel in it war on Gaza . At today ’ s hearing , the UN ’ s top court wa told an end to the hostility wa a matter of extreme urgency and that Israel ’ s action clearly indicate “ genocidal intent . ”",16 May 2024,al-j,,south africa seek third intervention against israel at icj
"In strongest criticism yet , Biden take issue with Israel ’ s approach but not it devastating war on Gaza .",10 Apr 2024,al-j,united state president joe biden ha said israeli prime minister benjamin netanyahu is making a “ mistake ” in his handling of the gaza war and it repercussion inside israel and internationally .,biden : israel ’ s netanyahu making ‘ mistake ’ on gaza
"Israeli official are accused of using phone tap , spying and intimidation against ICC prosecutor to derail possible war crime investigation . It ’ s a decade long operation against the world court , a Al Jazeera ’ s Soraya Lennie explains .",30 May 2024,al-j,,phone tap and intimidation : israel ’ s war against the icc
"UN agency , aid group warn of devastating consequence of any military assault on Rafah after Israel order ten of thousand to evacuate city in southern Gaza .",6 May 2024,al-j,"the israeli army ha ordered ten of thousand of palestinian to leave rafah amid growing fear of a ground assault on the southern gaza city , where 1.4 million people displaced by israel ’ s war on gaza have sought shelter .",world reacts to israel ’ s rafah evacuation order
"Republican legislator threaten ‘ consequence ’ against International Criminal Court official , including travel ban .",20 May 2024,al-j,lawmaker in the united state have slammed the international criminal court ’ s ( icc ’ s ) decision to seek arrest warrant for senior israeli official accused of war crime in gaza with some republican threatening to impose “ consequence ” against the international tribunal .,u lawmaker slam icc prosecutor ’ s israel arrest warrant request
"At least 32,600 Palestinians have been killed by Israel since October 7 , with 71 killed in the last 24 hour .",29 Mar 2024,al-j,"israel ha continued it aerial and ground bombardment of the gaza strip , killing dozen more palestinian , a fighting rage around gaza city ’ s main al-shifa hospital , palestinian official and the israeli military said .",israeli air raid kill dozen across the gaza strip
Baraa Odeh ha told her lawyer from prison that she ha been repeatedly strip-searched and physically assaulted .,3 May 2024,al-j,"berlin , germany – a palestinian employee of germany ’ s state-funded development agency ha been imprisoned in israel for more than a month , where she ha been beaten and subject to abusive and humiliating treatment , her family member and lawyer say .",palestinian employee of german development agency ‘ abused ’ in israeli jail
EU insider and voter say many will be backing party that are supportive of Gaza .,6 Jun 2024,al-j,"brussels , belgium – election for the european parliament traditionally focus on issue such a the cost of living , farm policy , climate change and the european union ’ s migration policy .",‘ the battleground is palestine ’ : israel ’ s war loom over european election
Announcement that Hamas number three Marwan Issa wa killed March 10 come just a day after UN ’ s Gaza ceasefire call .,26 Mar 2024,al-j,the live page is now closed . you can continue to follow our coverage of the war in gaza here .,israel ’ s war on gaza update : israel say hamas chief killed on march 10
"In these dark time , it is heartening to see the Palestinian cause conquering new terrain in Washington and beyond .",28 May 2024,al-j,"in the wee hour of may 8 , police officer in washington , dc violently cleared the pro-palestine encampment at george washington university ( gw ) with the help of pepper spray , arresting 33 people . university president ellen granberg had called the cop on what she claimed wa an “ unlawful ” on-campus expression of solidarity with the victim of israel ’ s current genocide in the gaza strip , which ha officially killed some 36,000 people in less than eight month , although this number is no doubt a grave underestimate .",letter from ‘ kibbutz israel ’
Activists are calling attention to historical tie between university and defence contractor linked to Israel ’ s war .,13 May 2024,al-j,"los angeles , california – a the war in gaza enters it eighth month , israel ’ s military campaign , one of the most destructive in modern history , ha killed nearly 35,000 palestinian , most of them woman and child .",u university tie to weapon contractor under scrutiny amid war in gaza
Thousands of ultranationalist Israelis paraded through occupied East Jerusalem a part of an annual ‘ Jerusalem Day ’ flag march . Video showed them antagonising Palestinian and Arab local and attacking Palestinian journalist Saif Kwasmi .,5 Jun 2024,al-j,,palestinian journalist attacked by right-wing ‘ jerusalem day ’ marcher
UN Special Rapporteur Francesca Albanese explains how Israel justifies it killing and mass destruction in Gaza .,11 Apr 2024,al-j,"to the united nation official tasked with reporting on palestinian human right , international law is clear : israel should withdraw from the territory it occupied in 1967 .",doe israel twist humanitarian law to justify gaza carnage ?
World Central Kitchen is known for feeding people around the world . Why did Israel open fire on it worker ?,5 Apr 2024,al-j,,did israel intentionally target a world central kitchen convoy in gaza ?
"Biden ’ s ‘ ironclad ’ backing of Israel is coming into conflict with the US ’ s stated goal of averting regional war , analyst say .",12 Apr 2024,al-j,"washington , dc – united state president joe biden had a brief but stern warning for iran a it promised to retaliate against israel for a deadly air raid on it consulate in damascus : “ don ’ t . ”",‘ disastrous ’ : israel-iran tension test limit of u policy amid gaza war
Far-right religious party are backing the bill with a view to inserting change and limiting conscription .,11 Jun 2024,al-j,the israeli knesset ha voted to revive a bill that would end exemption on military conscription for some ultra-orthodox religious student .,israel ’ s knesset advance contentious ultra-orthodox conscription law
Man shot to death in the occupied West Bank town of al-Mughayyir during one of 700 settler attack on Palestinians .,12 Apr 2024,al-j,this live page is now closed . please follow the latest update here .,israel ’ s war on gaza update : one dead a settler rampage in west bank
"The Nakba is at the core of the Palestinian struggle , but in many way pale in comparison to Israel ’ s war on Gaza .",14 May 2024,al-j,"palestinian will mark the 76th anniversary of their mass expulsion from what is now israel , an event that is at the core of their national struggle . but in many way , that experience pale in comparison to the calamity now unfolding in gaza .",palestinian mark 76 year of nakba a new tragedy unfolds in gaza
The historically Black college is one of several US university to hold protest demanding an end to the killing in Gaza .,19 May 2024,al-j,"joe biden ha sought to address anger on united state university campus over his support for israel amid the war in gaza , a the u president delivered a graduation speech at a historically black college attended by martin luther king jr .",biden delivers address at morehouse college amid anger over gaza war
Palestinian politician Mustafa Barghouti and US professor Ian Lustick dissect Biden ’ s refusal to end the war in Gaza .,24 Mar 2024,al-j,"all of israel ’ s modern war have ended with u intervention , but the current war in gaza ha gone on for half a year because “ biden is a slow learner ” , argues university of pennsylvania political scientist ian lustick .",doe israel need to be forced by the u to end the war in gaza ?
At least eight people killed in an Israeli attack in Bani Suheila a desperate Palestinians gathered for aid dispersal .,24 Jun 2024,al-j,this live page is now closed .,israel war on gaza update : deadly attack on palestinian awaiting aid
"While Hamas welcomed the ceasefire resolution passed in UNSC , Israel seems determined to continue the war in Gaza .",11 Jun 2024,al-j,the united nation security council ( unsc ) endorsed a united states-backed ceasefire resolution on monday in the latest diplomatic effort to end eight month of israel ’ s devastating military offensive in the gaza strip .,will israel accept the new un gaza ceasefire resolution ?
The 23-year-old Israeli American criticises Israeli PM Netanyahu in the undated three-minute clip .,25 Apr 2024,al-j,"hamas ha released a video of an israeli-american man held captive in the gaza strip for the duration of israel ’ s war on the enclave , igniting new protest calling on the israeli government to do more to secure the captive ’ release .",hamas video of gaza captive hersh goldberg-polin trigger israel protest
"Israel ’ s military ha destroyed some 50,000 housing unit and bulldozed drainage network and road in northern Gaza .",3 Jun 2024,al-j,palestinian municipal authority have declared the city of jabalia and beit hanoon in the northern gaza strip “ disaster area ” .,gaza ’ s jabalia and beit hanoon declared ‘ disaster area ’
It is not naive to know that the only route to justice and equality is peace .,20 Jun 2024,al-j,we are an israeli and a palestinian who forged an “ unlikely ” friendship when the world expected u to hate each other .,"when it come to israel-palestine , true naivety is believing in endless war"
"Two-thirds of Gaza ’ s 36 hospital are ‘ non-functional , ’ according to the UN .",28 Mar 2024,al-j,"here ’ s how thing stand on thursday , march 28 , 2024 :","israel ’ s war on gaza : list of key event , day 174"
Israeli air raid put Kuwaiti Hospital out of service and trap medical staff and patient inside Indonesian Field Hospital .,28 May 2024,al-j,"the gaza strip ’ s collapsing health system is under further strain after the israeli army intensified bombing in rafah ’ s tal as-sultan area and other part of the enclave , a day after an attack on a camp in rafah killed 45 palestinian .",rafah resident face further danger a israel hit city ’ s two hospital
United Nations chief say ‘ growing consensus emerging in international community to tell Israel a ceasefire is needed ’ .,25 Mar 2024,al-j,"the israeli military ha besieged three hospital in gaza , with medical team under heavy gunfire , a a divided united nation security council is set to vote on a new draft resolution calling for an “ immediate ” ceasefire in the enclave .",unsc to vote on new gaza ceasefire draft a israel besieges three hospital
UNIFIL investigation find Israeli tank killed Reuters reporter Issam Abdallah and wounded several others in October .,14 Mar 2024,al-j,"an israeli tank killed reuters reporter issam abdallah in lebanon last year by firing two 120mm round at a group of “ clearly identifiable journalist ” in violation of international law , a united nation investigation into the october 13 incident ha found .",israeli strike killed ‘ clearly identifiable ’ reporter in lebanon : un probe
"The number of arrest ha crossed 1,100 since New York police detained first demonstrator at Columbia on April 18 .",30 Apr 2024,al-j,columbia university ha begun suspending student demonstrator after they defied an ultimatum to disperse .,columbia suspends student after deadline to end gaza camp pass
"Pained cry of the injured , frantic effort by medic and unspeakable scene of the aftermath in Kuwaiti Hospital .",27 May 2024,al-j,"a little girl in pink pyjama ha been settled on a bloodied bed at kuwait specialty hospital in gaza ’ s southern city of rafah , her face bewildered a she blink repeatedly .","israel attacked rafah at night , ‘ all the people burned ’"
The medium is playing a central role in the clash between progressive youth and the political establishment in the US .,25 May 2024,al-j,"a israel continues to wage it genocidal war on gaza , a fault line in american society is becoming increasingly more pronounced . university student are challenging the political establishment on university campus across the country .",watching the watchdog : the u medium and intergenerational fault line
President say new government must tackle local and international issue .,3 Jun 2024,al-j,egyptian president abdel fattah el-sisi ha reappointed prime minister mostafa madbouly to form a new government .,"egypt ’ s el-sisi reappoints pm madbouly , order him to form new cabinet"
"Watch the moment hundred of Iranian missile and drone are launched at Israel , with most intercepted . No death have been reported . Iran say it wa retaliation for Israel ’ s attack on it Damascus consulate which killed Iranian general .",14 Apr 2024,al-j,,iran launch direct attack on israel
"The song contest pride itself on being nonpolitical , but Israel ’ s inclusion threatens to overshadow the music this year .",13 Mar 2024,al-j,"for some , it is the oscar . for others , it is rio ’ s carnival . for many , there is no annual event quite like eurovision , the international singing contest extravaganza that attracts million of viewer and feature everything from power ballad and punk rock to death metal and folk dancing .",why wa israel forced to change it song entry for eurovision ?
Police fired tear gas at protester who ’ d set up a camp at the University of South Florida to condemn Israel ’ s war on Gaza . Several student were reportedly arrested a the camp wa dismantled .,1 May 2024,al-j,,police use tear gas on anti-war protester at florida university
We look at the violence and intimidation that face those in Germany calling for an end to Israel ’ s war on Gaza .,25 Jun 2024,al-j,"public shaming in national newspaper , arbitrary arrest and even beating by police – these are just a few of the consequence that those protesting for an end to israel ’ s war on gaza say they face in germany .",what have palestine activist in germany been facing ?
The Israeli military say it is continuing to conduct ‘ precise operation ’ at al-Shifa Hospital .,22 Mar 2024,al-j,"here ’ s how thing stand on friday , march 22 , 2024 :","is­rael ’ s war on gaza : list of key event , day 168"
Nine body found so far after doctor say they witnessed killing and burial by Israeli force .,15 Apr 2024,al-j,this live page is now closed . you can continue to follow our coverage of the war in gaza here .,israel ’ s war on gaza update : new mass grave found at al-shifa hospital
Al Jazeera spoke to several released detainee about their ordeal in Israeli holding facility .,13 Mar 2024,al-j,"though it ha yet to respond to al jazeera ’ s request for comment , israel continues to push back against the accusation of torture levelled at it armed force in an unpublished report by the united nation relief and work agency for palestine refugee ( unrwa ) .",not just the unrwa report : countless account of israeli torture in gaza
"Despite Israeli authority blocking thousand of Palestinians from reaching the Al-Aqsa Mosque for first Friday prayer of Ramadan , around 80,000 worshipper are reported to have made it to the holy site .",15 Mar 2024,al-j,,first friday prayer of ramadan in al-aqsa
New York-based university move to suspend student involved a police arrest them for trespassing .,19 Apr 2024,al-j,more than 100 pro-palestinian protester have been arrested on the campus of new york ’ s columbia university a police cleared an encampment set up by student demonstrating against israel ’ s war in gaza .,dozen of pro-palestinian protester arrested a columbia clear encampment
But there is one important difference between the two case : The genocide in Gaza is not taking place in the dark .,11 Jun 2024,al-j,"while our eye were on rafah ’ s “ block 2371 ” – the small area in south gaza which the israeli military designated a a “ safe humanitarian zone ” on may 22 but went on to bomb just four day later , massacring at least 45 civilian sheltering in tent – we were reminded of a 15-year-old confidential cable intercepted by wikileaks describing the plight of civilian in the final day of the sri lankan civil war .","like sri lanka once did , israel ha turned ‘ safe zone ’ into killing field"
"Our correspondent in Gaza say at least 30 people injured in the attack , which Reuters say wa near an aid crossing .",19 Jun 2024,al-j,this live page is now closed . you can continue to follow our coverage of the war in gaza here .,israel war on gaza update : 9 killed in israeli attack on rafah aid seeker
"After Israel kill more than 350 medical worker in Gaza , paramedic in the West Bank describe the threat they face .",20 Mar 2024,al-j,"hebron , occupied west bank – in his 25 year a a paramedic , jawdat al-muhtaseb ha worked during fraught time , from the second intifada to the heightened tension in 2015 and then to the current situation , where the ripple effect of israel ’ s war on gaza led to an increase in deadly israeli violence against palestinian in the occupied west bank .",palestinian paramedic fear gaza danger will spread to west bank
Diplomatic source tell Al Jazeera that Qatar will not accept becoming a tool to pressure negotiating party .,5 May 2024,al-j,"qatar ha stressed that it will not accept becoming a tool to pressure any party and that it is committed to maintaining it role a an honest mediator in it mediation between hamas and israel , diplomatic source told al jazeera arabic .",qatar committed to israel-hamas honest mediator role : diplomatic source
US President Joe Biden ha defended Israel against the International Criminal Court prosecutor ’ s request for the court to issue warrant to arrest Israeli and Hamas leader for alleged war crime .,21 May 2024,al-j,,‘ what ’ s happening is not genocide ’ say biden after icc warrant sought
"“ We want to raise the voice of those who still believe in a peaceful , non-violent solution , ” Norwegian Foreign Minister Espen Barth Eide told Al Jazeera . The three European country will formalise their decision on May 28 .",22 May 2024,al-j,,"norway , spain , ireland to recognise palestinian state"
"Israel say it pulled out thousand of soldier – including from war-ravaged Khan Younis – ahead of other operation , a truce talk in Cairo restart six month since the devastating conflict began .",7 Apr 2024,al-j,the live page is now closed . you can continue to follow our coverage of the war in gaza here .,israel ’ s war on gaza update : israel say troop moved for new operation
The NYPD arrested around 300 college protester from Columbia and CUNY after Hamilton Hall wa occupied and renamed “ Hind Hall ” .,1 May 2024,al-j,"on tuesday night , hundred of new york city police department ( nypd ) officer with riot shield and zip tie entered the columbia university campus and arrested more than 280 protester who had occupied hamilton hall , a key academic and administrative building , a day earlier . the police separately also arrested student protester at city college of new york ( cuny ) .","after police crackdown , what ’ s next for columbia ’ s gaza protester ?"
"UNSC call for a ‘ lasting , sustainable ceasefire ’ in Israel ’ s war with Hamas in Gaza and the release of all captive .",25 Mar 2024,al-j,the united nation security council ( unsc ) demand an immediate ceasefire between israel and the palestinian group hamas in the gaza strip and the release of all captive a the united state abstains from the vote .,un security council demand immediate gaza ceasefire a u abstains
"Videos of the attack on the anti-Gaza war protest camp at UCLA have shown the extent of the violence used by a pro-Israel mob . A day after the protester were assaulted , police in Los Angeles declared the camp unlawful and moved in to clear it .",2 May 2024,al-j,,video show violence of mob attack on ucla anti-war protester
The term wa invented by Serb genocidaires trying to cover up their crime in the Bosnian war .,2 Jun 2024,al-j,"over the past eight month , like many people around the world , i have been starting my day by checking the news from gaza and the rest of palestine . i rely on the report from people on the ground in gaza , mostly on social medium , to get reliable information about what is happening .","it is not ‘ ethnic cleansing ’ , it is genocide"
The Take speaks with Mariam Said about the protest at Columbia University and her advice for today ’ s activist .,1 May 2024,al-j,,the take : university protest spread across the u
There were report of punch thrown a pro-Israel and pro-Palestinian protester confronted each other at UCLA university in the US . The university said a barrier that had been separating the two group wa breached .,29 Apr 2024,al-j,,confrontation between rival protester at ucla over gaza war
"Medical source tell Al Jazeera that the newborn wa killed in an attack on Gaza City , and 30 were people were injured .",14 Jun 2024,al-j,this live page is now closed . you can continue to follow our coverage of the war in gaza here .,"israel ’ s war on gaza update : 25 killed in gaza today , including infant"
Indirect talk to end the conflict set in Egypt with CIA director and Qatari PM holding separate meeting with the Israeli and Hamas delegation .,7 Apr 2024,al-j,"here ’ s how thing stand on sunday , april 7 , 2024","israel ’ s war on gaza : list of key event , day 184"
A suspension of Israel ’ s right and privilege by the United Nations General Assembly would put much more pressure on it government than Palestine ’ s full membership .,20 May 2024,al-j,"when on may 10 , the united nation general assembly ( unga ) voted overwhelmingly in favour of resolution es-10/23 relating to palestine ’ s membership application , some medium qualified it a “ support for palestinian statehood ” . this seeming confusion follows the united state government ’ s talking point conflating statehood with membership and claiming this would hurt “ peace effort ” . that is , however , not the case : the resolution addressed the question of “ membership ” in the un and not of palestine ’ s “ statehood ” .",ostracising israel at the un should be a priority
"Asked whether the US ha evidence to support or refute the ICC ’ s allegation that Israel is using starvation a a tactic of war in Gaza , US President Joe Biden instead answered that there is “ no equivalence ” between Israel and Hamas .",23 May 2024,al-j,,biden avoids question on icc allegation against israel
"Mujahed Abadi , who had been shot twice , tell Al Jazeera that Israeli force beat him severely before letting him go .",24 Jun 2024,al-j,"mujahed abadi say ha not been able to sleep since israeli force shot him , beat him and strapped him to the hood of a military vehicle two day ago , apparently using him a a human shield .","palestinian man shot , tied to jeep say israeli force gave no explanation"
Qatar say the major sticking point remain the same a behind-the-scenes talk attempt to secure a truce in Gaza .,3 Apr 2024,al-j,"revived talk on a ceasefire between israel and hamas appear to be making little progress , with the two side showing few sign that they are ready to compromise on their demand .",gaza ceasefire talk stall a israel and hamas dig in
"The Israeli army ha launched a new attack on al-Shifa Hospital in Gaza , raiding and opening fire on the facility where thousand are taking shelter .",18 Mar 2024,al-j,,israeli force launch new attack on gaza ’ s al-shifa hospital
"Israeli operation in the West Bank city lead to casualty , displacement and popular anger .",2 Jun 2024,al-j,"on may 21 , amr musara went out to report on israel ’ s raid on the jenin refugee camp in the israeli-occupied west bank .",how israel ’ s raid on jenin only fuel palestinian resistance
