sub_title,date,Newspaper,Body Text,title
UN Secretary-General Antonio Guterres say it is time for Israel to give an ‘ ironclad commitment ’ for unfettered access to humanitarian good throughout Gaza .,23 Mar 2024,al-j,the live page is now closed . you can continue to follow our coverage of the war in gaza here .,israel ’ s war on gaza update : un chief say blocked aid a ‘ moral outrage ’
A mother and poet find herself lost for word to process the loss of her four child this Mother ’ s Day .,21 Mar 2024,al-j,"rafah , gaza – it is nearly impossible to describe the feeling of a mother in the gaza strip on mother ’ s day .",alaa ’ s sad mother ’ s day after israel ’ s war on gaza killed her child
"Inside the labyrinth of the State Department ’ s mechanism that allow the flow of weapon to Israel , despite violation .",12 May 2024,al-j,"over the year , the united state government ha been creating special mechanism to shield israel from sanction designed to punish country for human right abuse .",how the u state department shield israel from sanction
"Angered by Israel ’ s move in Gaza and the regional security risk they pose , Egypt joined the genocide case .",16 May 2024,al-j,"a israel devastates gaza , egypt ha largely had to watch on with rising concern about the development on it border .",why egypt backed south africa ’ s genocide case against israel in the icj
More than 76 percent of school in Gaza require ‘ full reconstruction or major rehabilitation ’ to be functional .,15 Jun 2024,al-j,"more than 76 percent of school in gaza require “ full reconstruction or major rehabilitation ” to be functional following israel ’ s months-long onslaught , according to a new assessment shared by the un office for the coordination of humanitarian affair .",israel ’ s targeting of gaza school ‘ eroding foundation for societal growth ’
"Students have occupied the building at pivotal moment in American history , often triggering policy change .",1 May 2024,al-j,"hamilton hall , the academic building at columbia university that student protesting against israel ’ s war on gaza occupied early on april 30 , ha a long history of student protest .",‘ hind hall ’ : how columbia ’ s hamilton hall became it signature protest hub
"Al Jazeera ’ s Gaza bureau chief bear scar of war , echo resilience globally .",31 Mar 2024,al-j,"journalist , especially in war zone , face immense challenge in reporting conflict reality .",wael dahdouh : gaza ’ s voice amid loss and courage
Israeli force kill 24 Palestinians in three attack a Hamas blame Biden administration for war of ‘ extermination ’ .,25 Jun 2024,al-j,"an israeli air strike ha killed 10 member of hamas chief ismail haniyeh ’ s family in northern gaza ’ s shati refugee camp , according to the palestinian group and the enclave ’ s civil defence agency .",israeli air strike kill 10 family member of hamas chief haniyeh in gaza
"The body found inside plastic bag that have Hebrew writing on them include elderly woman , child and young men .",21 Apr 2024,al-j,this live page is now closed . you can continue to follow our coverage of the war in gaza here .,israel ’ s war on gaza update : 180 body found in khan younis mass grave
US Secretary of State Antony Blinken warned the Israeli leader that a Rafah ground assault risk ‘ further isolating ’ Israel .,22 Mar 2024,al-j,"israeli prime minister benjamin netanyahu ha told the united state ’ s top diplomat that israel is determined to send troop into the southern gaza city of rafah , where some 1.5 million palestinian are sheltering , and will do so without u backing if necessary .",u top diplomat hold talk in israel a netanyahu vow rafah invasion
PM Netanyahu say a date ha been set for a ground offensive in Rafah after Israeli troop withdraw from nearby Khan Younis .,9 Apr 2024,al-j,"here ’ s how thing stand on tuesday , april 9 , 2024 :","israel ’ s war on gaza : list of key event , day 186"
Foreign policy chief Blinken threatens to withhold arm if Israel invades a Israeli army target civilian in Rafah .,12 May 2024,al-j,this live page is now closed . you can continue to follow our coverage of the war in gaza here .,israel ’ s war on gaza update : israel ha no ‘ credible plan ’ for rafah – u
"UNRWA chief say ‘ operationally , nothing ha changed yet ’ after Israeli army announced planned pause to allow more aid into Gaza .",17 Jun 2024,al-j,"israeli force battled with palestinian group in rafah and elsewhere in southern gaza despite the israeli military ’ s announcement on sunday of tactical pause in operation to allow humanitarian aid to enter , unrwa chief philippe lazzarini ha said .",gaza fighting continues despite israeli ‘ pause ’ announcement : unrwa
"These were update for the police raid and attack on pro-Palestinian student protester in the US on Wednesday , May 1 .",1 May 2024,al-j,this live page is now closed .,"update : new york police arrest 282 protester after columbia , ccny raid"
Dozens of student start a sit-in at university to protest decision not to review partnership with Israeli university .,2 May 2024,al-j,"the paris institute of political study ( science po ) ha rejected demand by protester to review it relation with israeli university , it interim director jean basseres say , prompting some student to say they would start a hunger strike in protest .",paris ’ s science po reject protester ’ demand to review israel tie
US police arrested more than 100 protester who had set up camp to demonstrate against Israel ’ s war on Gaza from Columbia University ’ s campus in New York .,19 Apr 2024,al-j,,over 100 pro-palestine protester arrested at u university
The UN Security Council ha adopted a resolution demanding an immediate ceasefire on Gaza .,26 Mar 2024,al-j,"here ’ s how thing stand on tuesday , march 26 , 2024 :","israel ’ s war on gaza : list of key event , day 172"
"Palestinians in Gaza are making preparation for Ramadan in the midst of Israel ’ s war on the territory , which pose immense challenge for those observing the holy month .",7 Mar 2024,al-j,,palestinian displaced by gaza war prepare for ramadan
"Spain , Ireland , Malta and Slovenia are expected to make the move , which will hold historic symbolism but have a limited effect , say analyst .",17 Apr 2024,al-j,spain is on a mission .,"spain lead european push to recognise palestine , risking israel ’ s wrath"
A man ha been filmed spraying an unknown liquid on protester ’ belonging and banner at a Palestine solidarity camp at the US University of Pennsylvania . He wa later seen being taken away by police .,2 May 2024,al-j,,man accused of spraying ‘ pesticide ’ on u anti-gaza war encampment
Iran say it first-ever direct attack on Israel wa revenge for Israel ’ s targeting of Iranian personnel . Tehran say it retaliation ha been ‘ concluded ’ but warns of a harsher response next time if Israel strike again .,14 Apr 2024,al-j,,celebration in iran a it ‘ concludes ’ retaliatory attack on israel
A Palestinian man wa filming a he risked his life to retrieve the body of two neighbour who were killed by Israeli sniper at their home in Gaza City .,21 Mar 2024,al-j,,palestinian man risk life to give neighbour a burial in gaza
UNICEF say one of it vehicle came under fire during an attempted aid delivery to northern Gaza . Spokeswoman Tess Ingram told Al Jazeera what happened .,11 Apr 2024,al-j,,unicef worker describes attack on gaza aid convoy
"Video from near Ramallah show Israeli force detaining several Palestinians during a reported campaign of mass arrest on Sunday . Campaigners say 9,000 Palestinians have been arrested in the occupied West Bank since the start of Israel ’ s war on Gaza .",24 Jun 2024,al-j,,israeli force carry out mass arrest in occupied west bank
"Norway , Ireland and Spain announce they will recognise an independent Palestinian state .",22 May 2024,al-j,"until now , most western country have maintained they will formally recognise palestinian statehood only at the end of a peace process with israel .",what doe the increasing recognition of palestinian statehood mean ?
Hezbollah say it detonated ‘ explosive device ’ targeting soldier who crossed the border into Lebanon .,15 Apr 2024,al-j,"several israeli soldier have been wounded in a blast in lebanon near the israeli border , according to the israeli military and the lebanese armed group hezbollah , which claimed responsibility for the attack .",several israeli soldier wounded in lebanon attack claimed by hezbollah
Israeli military say it force are continuing their siege of al-Shifa Hospital where they have claimed to have killed a number of fighter .,27 Mar 2024,al-j,"here ’ s how thing stand on wednesday , march 27 , 2024 :","israel ’ s war on gaza : list of key event , day 173"
"US Secretary of State Blinken , on a visit to Tel Aviv , say there should be ‘ no delay , no excuse ’ in reaching a ceasefire deal , claiming the only reason it may not happen ‘ is because of Hamas ’ .",1 May 2024,al-j,this live page is now closed . you can continue to follow our coverage of the war in gaza here .,israel ’ s war on gaza update : first time aid enters gaza via beit hanoon
"History set to be repeated a the US prepares to wield veto , insisting Palestine must negotiate statehood with Israel first .",9 Apr 2024,al-j,the un security council on monday asked it membership committee to review the palestinian authority ’ s application to be made a full member state of the united nation . the pa is currently a non-member observer state like the vatican .,"a palestine applies for full un membership , what ’ s in the way ?"
Polish Prime Minister Donald Tusk say attack on World Central Kitchen convoy and Netanyahu ’ s reaction caused ‘ understandable anger ’ .,3 Apr 2024,al-j,"there is growing outrage around the world after israeli air strike killed seven aid worker from the world central kitchen ( wck ) charity , a the country face increased scrutiny over it conduct in the war on gaza .",outrage grows over israel ’ s deadly attack on gaza aid convoy
The word of the Jewish lawyer who coined the term ‘ genocide ’ still hold lesson for u today .,19 Apr 2024,al-j,history illustrated is a weekly series of insightful perspective that put news event and current affair into historical context using graphic generated with artificial intelligence .,"gaza , genocide and the world ’ s most heinous crime"
Israeli official cite prime minister a saying daily pause is ‘ unacceptable ’ a army continues attacking Gaza .,16 Jun 2024,al-j,israeli prime minister benjamin netanyahu is opposed to plan announced by the military to hold daily tactical pause in fighting along one of the main road into the besieged and bombarded gaza strip to facilitate aid delivery into the palestinian enclave .,netanyahu opposed to israeli military ‘ tactical pause ’ for gaza aid
"Israeli force have launched a new offensive in northern Gaza , month after saying Hamas had been ‘ dismantled ’ there . Residential area sheltering displaced Palestinians have been flattened and tank have entered the Jabalia refugee camp , a Gaza ’ s death toll cross 35,000 people .",12 May 2024,al-j,,"israel pound northern gaza , month after declaring hamas dismantled"
Qatar say mediation effort are being hampered by Israel ’ s offensive on Gaza ’ s southern city .,14 May 2024,al-j,"israel ’ s military operation in gaza ’ s southern city of rafah ha set ceasefire negotiation with hamas “ backward ” , mediator qatar ha said , adding that the talk have lost steam .",gaza ceasefire deadlocked a israel ’ s rafah attack set talk ‘ backward ’
Staff warned that language in the national broadcaster ’ s coverage ‘ favoured the Israeli narrative over objective reporting ’ .,26 Mar 2024,al-j,"staff at australia ’ s national broadcaster warned that it coverage of the war in gaza relied too much on israeli source and used language that “ favoured the israeli narrative over objective reporting ” , internal communication reveal , shedding new light on bias claim that convulsed the outlet .",abc australia staff ’ s concern over pro-israel bias revealed
Dozens at the University of Leeds step up protest a Zecharia Deutsch continues his role a campus chaplain .,8 Mar 2024,al-j,student at a university in northern england are staging a sit-in to call for the suspension of a jewish chaplain who ha served in the israeli army during the war on gaza .,uk student call on university to suspend rabbi who served in israeli army
Palestinians have been recovering body and remains of people killed at Gaza ’ s al-Shifa Hospital after a two-week assault by Israeli force .,9 Apr 2024,al-j,,body recovered from gaza ’ s al-shifa hospital after two-week israeli raid
The Israeli attack intensify a US President Biden ’ s truce proposal receives positive response from Hamas but Netanyahu set condition .,1 Jun 2024,al-j,this live page is now closed . you can continue to follow our coverage of the war in gaza here .,israel ’ s war on gaza update : ‘ over 1 million ’ flee rafah a israel attack
Amos Hochstein is also set to visit Lebanon amid growing fear of an all-out war between Hezbollah and Israel .,17 Jun 2024,al-j,a senior united state diplomat ha met israeli leader and will later visit lebanon a part of a push by washington to defuse tension between israel and hezbollah .,u envoy meet with israeli leader a tension with hezbollah escalate
"The police response to Spain ’ s campus protest ha been relatively muted while more than 2,000 academic stand by their university student .",8 May 2024,al-j,"madrid , spain – huge palestinian flag are hanging on campus across spain a thousand of student protest against israel ’ s war in gaza .",support from lecturer and no arrest a spanish student protest for gaza
The move come a the Palestinian Authority face pressure to reform from the US amid Israel ’ s war on Gaza .,14 Mar 2024,al-j,palestinian president mahmoud abbas ha appointed his longtime economic adviser mohammed mustafa to be the next prime minister in the face of u pressure to reform the palestinian authority a part of washington ’ s post-war vision for gaza .,palestinian president abbas appoints mohammed mustafa a prime minister
Experts say Western ally are risking sanction from the ICJ if they continue to ship arm to Israel .,3 Apr 2024,al-j,"an attack on a humanitarian convoy , killing several foreign aid worker . the destruction of a hospital with hundred killed inside . an air raid on a consulate in a foreign country .",western ally face genocide complicity if support for israel continues
South Africa seek new emergency measure over Israel ’ s latest offensive against the southern city in Gaza .,10 May 2024,al-j,"south africa ha asked the international court of justice ( icj ) to order israel to withdraw from rafah a part of additional emergency measure over the war in gaza , the united nation ’ s top court said .",south africa asks icj to order israel to withdraw from gaza ’ s rafah
Qatar ’ s prime minister say there ha been ‘ abuse and harm ’ done related to Doha ’ s mediation effort .,17 Apr 2024,al-j,"qatar ’ s prime minister ha said doha is re-evaluating it role a a mediator in negotiation aimed at bringing about a ceasefire in gaza and the release of israeli captive , adding that some party have used the mediation for “ narrow political interest ” .",qatar ‘ re-evaluating ’ role a mediator in israel-gaza truce talk
"Palestinian family have begun leaving eastern Rafah after the Israeli military ordered it evacuation , saying it will use ‘ extreme force ’ there . World leader have repeatedly warned against a military offensive where more than 1.5 million displaced people are sheltering .",6 May 2024,al-j,,israel order rafah evacuation after night of intense bombardment
"Mahmoud Darwish ’ s poem are ever relevant to the condition of Palestinians , particularly now in Gaza .",13 Mar 2024,al-j,"the beauty of gaza is that our voice do not reach it . nothing distracts it ; nothing take it fist from the enemy ’ s face . gaza is devoted to rejection … hunger and rejection , thirst and rejection , displacement and rejection , torture and rejection , siege and rejection , death and rejection … ”","‘ the war will end ’ : remembering mahmoud darwish , palestine ’ s poetic voice"
"Discover how Israeli military tactic shape US ‘ cop city ’ , affecting civil liberty and racial justice for marginalised community .",18 Jun 2024,al-j,"critic of the increasing integration of israeli military technology and tactic into united state “ cop city ” say the exchange lead to a more militarised approach to urban policing . activist and organiser say this shift impact civil liberty and perpetuates systemic racism against marginalised u community . they say police exchange programme promote aggressive method from conflict zone , while simultaneously diverting fund from essential social service .",how the u is using israeli military tactic on marginalised community
Police crack down on demonstration at UT Austin and USC a student at Harvard and Brown set up encampment in protest against Israel ’ s war on Gaza .,25 Apr 2024,al-j,"student protester in the united state have vowed to continue demonstration against israel ’ s war on gaza , despite the arrest of dozen of protester at the university of texas at austin ( ut austin ) , the university of southern california ( usc ) , georgia ’ s emory university and boston ’ s emerson college .","student vow to continue gaza protest after california , texas arrest"
Raji Sourani left the strip with his family a the war raged . He then joined colleague in Sicily to try to take Israel to the ICJ .,8 Apr 2024,al-j,"messina , italy – pile of court document in english and arabic filled the desk and covered the floor of triestino mariniello ’ s home office for much of march in messina , a city in southern italy overlooking mediterranean water on one side and the smoking etna volcano on the other .","in italy , a palestinian lawyer who fled gaza build israel genocide case"
Human Rights Watch say aid worker ’ convoy and facility have been targeted at least eight time since last October .,14 May 2024,al-j,"israeli force have attacked humanitarian aid convoy and building in the gaza strip at least eight time since october despite being given coordinate to ensure their protection , human right watch ( hrw ) ha said in a new report .",israeli force attacked ‘ known aid worker location ’ in gaza : right group
Dentistry student Tasneem Ahel made a dangerous journey to flee north Gaza in the hope of making it overseas to complete her education . Israel ’ s war ha destroyed all Gaza ’ s university and left thousand of student with no access to education .,9 Apr 2024,al-j,,israel ’ s war is depriving gaza ’ s student of an education
"US presidential candidate say October 7 Hamas attack wa brutal , but Israel is now losing international support .",26 Mar 2024,al-j,"donald trump , the former u president and republican candidate in november ’ s election in the united state , ha warned israel it is losing international support and should “ finish up ” it war in gaza .",donald trump say time for israel to ‘ finish up ’ gaza war
"From air strike to field execution , Fault Lines investigates the killing of civilian by the Israeli military in Gaza and the role of the United States in the war .",21 Jun 2024,al-j,"a israel ’ s bombing campaign continues in gaza and the humanitarian crisis deepens to catastrophic level , the biden administration ha not wavered in it support for israel .",‘ the night won ’ t end ’ : biden ’ s war on gaza
Turkey say the ban will stay in place until Israel agrees to a permanent ceasefire in Gaza .,4 May 2024,al-j,"for year , israel and turkey have been crucial trade partner .",how effective is turkey ’ s ban on trade with israel ?
First payment of $ 20m to be disbursed after Sweden get assurance of the UNRWA ’ s check on spending and personnel .,9 Mar 2024,al-j,sweden ha said it is resuming aid to the cash-strapped united nation agency for palestinian with an initial disbursement of $ 20m after receiving assurance of extra check on it spending and personnel .,sweden resume aid to unrwa a israel step up gaza attack
"76 year on from the Nakba , Palestinians continue to demand their right of return after they were expelled from their home during the creation of the Israeli state in 1948 . Al Jazeera ’ s Nada Qaddourah break down the situation and look at the parallel with Israel ’ s current war on Gaza .",15 May 2024,al-j,,nakba remembered : what is the right of return ?
US president insists Israel and Hamas can not be compared after ICC seek warrant over alleged Israeli war crime .,21 May 2024,al-j,united state president joe biden ha defended israel against war crime charge in the world ’ s top court .,‘ no equivalence ’ : biden defends israel after icc request arrest warrant
The UN agency say surviving child do not ‘ even have the energy to cry ’ a famine loom in the besieged enclave being bombarded for month .,17 Mar 2024,al-j,"israel ha killed more than 13,000 child in gaza since october 7 while others are suffering from severe malnutrition and do not “ even have the energy to cry ” , say the united nation child ’ s fund ( unicef ) .","over 13,000 child killed in gaza , others severely malnourished : unicef"
MV Andromeda Star suffers damage and MQ-9 Reaper drone shot down in latest escalation by the Houthis .,27 Apr 2024,al-j,yemen ’ s houthis have damaged an oil tanker and downed another mq-9 reaper drone of the united state a they promise more attack in opposition to israel ’ s war on gaza .,"yemen ’ s houthis damage oil tanker , shoot down u drone"
"The Israeli army bombed a displacement camp in south Gaza , the Gaza Civil Defence said , killing and wounding dozen .",26 May 2024,al-j,this live page is now closed . you can continue to follow our coverage of the war in gaza here .,israel ’ s war on gaza update : ‘ more than 30 ’ killed in rafah strike
At least 32 Palestinians killed in 24 hour a Gaza medic scour mass grave site inside Khan Younis ’ s Nasser Hospital with 310 body discovered so far .,23 Apr 2024,al-j,this live page is now closed . you can continue to follow our coverage of the war in gaza here .,"israel ’ s war on gaza update : unrwa in ‘ unprecedented crisis ’ , say chief"
The UN say a quarter of the people in Gaza are ‘ one step away ’ from famine . Some child may never recover .,7 Mar 2024,al-j,,the take : gaza ’ s starvation loom over biden ’ s state of the union address
"Western outlet ignoring the unprecedented legal campaign against Israel , and it ally risk appearing complicit .",23 Apr 2024,al-j,"in a fast-expanding global battleground , enablers and opponent of israel ’ s genocidal assault on gaza are facing off in an unusual landscape : courtroom . over the past six month , lawyer , activist , organisation and state who believe that international law and convention that prohibit genocide actually mean something and must be implemented have submitted an unprecedented number of lawsuit and motion to national and international court .",watching the watchdog : the medium downplays a big legal story at it peril
Prime minister and official say Israel will continue fight even a US increase pressure over Rafah assault .,9 May 2024,al-j,"israeli official have struck a defiant tone after u president joe biden warned that the united state would not provide weapon for a full-scale ground assault on the southern gaza city of rafah , where hundred of thousand of displaced palestinian are hemmed in with no safe way to leave .",‘ fight with our fingernail ’ : israel ’ s netanyahu defies u weapon warning
Failure to launch an investigation into genocide in Gaza and issue arrest warrant can have a devastating impact on the International Criminal Court .,21 Apr 2024,al-j,"over the past few month , the international criminal court ( icc ) under the leadership of prosecutor karim khan ha come under heavy criticism for not taking any concrete step to prosecute the crime of genocide in gaza .",the icc can no longer ignore the genocide in gaza
Boycotts over the Gaza war are hitting big brand in Southeast Asia despite local owner denying link to Israel .,20 Mar 2024,al-j,"medan , indonesia – ordinarily during the holy month of ramadan , entrepreneur putra kelana break fast with his family and friend at several different food outlet across his city in north sumatra .","in indonesia and malaysia , boycott hammer mcdonald ’ s , starbucks"
"These were the update for the ICJ ruling on Nicaragua ’ s Gaza ‘ genocide ’ case against Germany for Tuesday , April 30 , 2024 .",30 Apr 2024,al-j,this live page is now closed .,update : icj rule against imposing measure on germany over israel aid
"This week on UpFront , Marc Lamont Hill talk to the author of a new scathing report on US arm sale to Israel .",26 Apr 2024,al-j,"a israel ’ s war on gaza continues for a seventh month , killing more than 34,000 palestinian and 200 humanitarian worker , the united state just approved roughly $ 15bn in military aid to israel . but is this transfer of weapon against both domestic and international law ?",arming genocide ? new report document use of u arm in israeli war crime
